{
  "schema_version": "ace.refusal_receipt.v0",
  "receipt_id": "rr_example_forbidden_write_001",
  "receipt_type": "refusal_receipt",
  "status": "REFUSED",
  "created_at": "2026-06-09T12:00:00Z",
  "emitted_before_execution": true,
  "mandate_id": "mandate_support_agent_read_only_v0",
  "proposal_id": "proposal_write_customer_record_001",
  "agent_context": {
    "agent_id": "support-agent-v0",
    "agent_role": "customer_support_assistant",
    "operator": "hichem",
    "workspace": "public-example",
    "action_class": "LOCAL_FILE_CHANGE",
    "boundary_mode": "read_only",
    "approval_state": "MISSING"
  },
  "requested_action": {
    "type": "file_write",
    "target": "examples/data/customer_1427.csv",
    "purpose": "update customer record",
    "expected_side_effect": "modify a local customer data file"
  },
  "policy": {
    "policy_id": "ace.boundary.read_only.v0",
    "policy_name": "Read-only boundary",
    "rule_id": "writes_allowed_false",
    "reason": "The active boundary allows reading and drafting only. File writes are not admitted."
  },
  "decision": {
    "decision_id": "deny_forbidden_write_001",
    "result": "REFUSED",
    "checks_run": [
      "boundary_present",
      "requested_action_detected",
      "action_class_checked",
      "write_permission_checked",
      "write_permission_absent"
    ],
    "refusal_reasons": [
      "write_not_allowed_inside_read_only_boundary",
      "human_review_or_new_explicit_boundary_required"
    ]
  },
  "no_side_effect_attestation": {
    "execution_started": false,
    "actual_action": "none",
    "side_effects_detected": false,
    "write_operations_made": false,
    "external_calls_made": false,
    "files_modified": [],
    "commands_run": [],
    "runtime_action_id": "none",
    "outbound_request_id": "none",
    "proof": [
      "decision emitted before any file write step",
      "requested target appears only in requested_action",
      "files_modified is empty",
      "commands_run is empty"
    ]
  },
  "integrity": {
    "method": "hash_chain",
    "content_hash": "sha256:REPLACE_WITH_CANONICAL_RECEIPT_HASH",
    "chain_anchor": "public-example"
  },
  "replay": {
    "replay_inputs": [
      "mandate_support_agent_read_only_v0",
      "requested_action.type=file_write",
      "requested_action.target=examples/data/customer_1427.csv",
      "boundary_mode=read_only",
      "approval_state=MISSING"
    ],
    "verification_steps": [
      "load active mandate",
      "confirm writes_allowed=false",
      "classify requested action as LOCAL_FILE_CHANGE",
      "verify required approval is missing",
      "expect refusal before execution"
    ],
    "expected_result": "REFUSED before execution because file writes are outside the read-only boundary"
  },
  "safe_next_action": "Prepare a draft change request for human review or issue a new explicit boundary that allows this write.",
  "human_review_required": true
}
